{
 "format": "z1r-seed",
 "formatVersion": "1.0",
 "producer": {
  "name": "ZORA",
  "version": "2.0.0b7"
 },
 "seed": {
  "number": "7",
  "flags": "8hq4BeQAdkhiCIuI9Xea1hzS3QUJ2v",
  "zoraFlags": "7.iQCEKa",
  "code": [
   "Recorder",
   "Bow",
   "Magical Sword",
   "Blue Potion"
  ]
 },
 "progressiveItems": false,
 "levels": [
  {
   "number": 1,
   "shownNumber": 1,
   "color": "#A0AA00",
   "rooms": [
    {
     "number": 7,
     "column": 4,
     "row": 1,
     "type": "Four Short Room",
     "enemies": {
      "name": "Red Bubble",
      "count": 5
     },
     "item": {
      "name": "Magical Key",
      "drop": true,
      "appears": "foes"
     },
     "staircase": null,
     "doors": {
      "north": "solid",
      "east": "shutter",
      "south": "solid",
      "west": "solid"
     }
    },
    {
     "number": 8,
     "column": 5,
     "row": 1,
     "type": "Pointless Moat Room",
     "enemies": {
      "name": "Vire",
      "count": 6
     },
     "item": {
      "name": "Wand",
      "drop": true,
      "appears": "foes"
     },
     "staircase": null,
     "doors": {
      "north": "solid",
      "east": "solid",
      "south": "shutter",
      "west": "open"
     }
    },
    {
     "number": 23,
     "column": 4,
     "row": 2,
     "type": "Triforce Room",
     "enemies": {
      "name": "Blue Gohma"
     },
     "item": {
      "name": "Key",
      "drop": false,
      "appears": "floor"
     },
     "staircase": null,
     "doors": {
      "north": "solid",
      "east": "locked",
      "south": "open",
      "west": "solid"
     }
    },
    {
     "number": 24,
     "column": 5,
     "row": 2,
     "type": "Pointless Moat Room",
     "enemies": {
      "name": "Red Bubble",
      "count": 6
     },
     "item": null,
     "staircase": null,
     "doors": {
      "north": "open",
      "east": "solid",
      "south": "solid",
      "west": "locked"
     }
    },
    {
     "number": 39,
     "column": 4,
     "row": 3,
     "type": "Narrow Stair Room",
     "enemies": {
      "name": "Mixed Enemy Group 28",
      "count": 8
     },
     "item": {
      "name": "Compass",
      "drop": true,
      "appears": "foes"
     },
     "staircase": {
      "kind": "transport",
      "number": 1,
      "to": 55
     },
     "doors": {
      "north": "open",
      "east": "solid",
      "south": "shutter",
      "west": "solid"
     }
    },
    {
     "number": 55,
     "column": 4,
     "row": 4,
     "type": "Narrow Stair Room",
     "enemies": {
      "name": "Red Bubble",
      "count": 6
     },
     "item": {
      "name": "Map",
      "drop": true,
      "appears": "foes"
     },
     "staircase": {
      "kind": "transport",
      "number": 1,
      "to": 39
     },
     "doors": {
      "north": "shutter",
      "east": "solid",
      "south": "open",
      "west": "solid"
     }
    },
    {
     "number": 56,
     "column": 5,
     "row": 4,
     "type": "Four Fireball Room",
     "enemies": {
      "name": "Mixed Enemy Group 17",
      "count": 5
     },
     "item": {
      "name": "Triforce",
      "drop": true,
      "appears": "foes"
     },
     "staircase": null,
     "doors": {
      "north": "solid",
      "east": "solid",
      "south": "open",
      "west": "solid"
     }
    },
    {
     "number": 71,
     "column": 4,
     "row": 5,
     "type": "Single Six Block Room",
     "enemies": {
      "name": "Red Bubble",
      "count": 3
     },
     "item": {
      "name": "Key",
      "drop": true,
      "appears": "foes"
     },
     "staircase": null,
     "doors": {
      "north": "open",
      "east": "open",
      "south": "bombable",
      "west": "solid"
     }
    },
    {
     "number": 72,
     "column": 5,
     "row": 5,
     "type": "Two Fireball Room",
     "enemies": {
      "name": "Blue Keese",
      "count": 8
     },
     "item": {
      "name": "Key",
      "drop": true,
      "appears": "foes"
     },
     "staircase": null,
     "doors": {
      "north": "open",
      "east": "solid",
      "south": "solid",
      "west": "open"
     }
    },
    {
     "number": 87,
     "column": 4,
     "row": 6,
     "type": "Horizontal Moat Room",
     "enemies": {
      "name": "Single Dodongo"
     },
     "item": {
      "name": "Key",
      "drop": false,
      "appears": "floor"
     },
     "staircase": null,
     "doors": {
      "north": "bombable",
      "east": "solid",
      "south": "bombable",
      "west": "solid"
     }
    },
    {
     "number": 103,
     "column": 4,
     "row": 7,
     "type": "Two Fireball Room",
     "enemies": {
      "name": "Mixed Enemy Group 21",
      "count": 8
     },
     "item": {
      "name": "Key",
      "drop": true,
      "appears": "foes"
     },
     "staircase": null,
     "doors": {
      "north": "bombable",
      "east": "open",
      "south": "open",
      "west": "solid"
     }
    },
    {
     "number": 104,
     "column": 5,
     "row": 7,
     "type": "Two Fireball Room",
     "enemies": {
      "name": "Mixed Enemy Group 12",
      "count": 6
     },
     "item": {
      "name": "Bombs",
      "drop": true,
      "appears": "foes"
     },
     "staircase": null,
     "doors": {
      "north": "solid",
      "east": "solid",
      "south": "solid",
      "west": "open"
     }
    },
    {
     "number": 119,
     "column": 4,
     "row": 8,
     "type": "Entrance Room",
     "enemies": null,
     "item": null,
     "staircase": null,
     "doors": {
      "north": "open",
      "east": "bombable",
      "south": "open",
      "west": "solid"
     }
    },
    {
     "number": 120,
     "column": 5,
     "row": 8,
     "type": "Four Fireball Room",
     "enemies": null,
     "item": null,
     "staircase": null,
     "doors": {
      "north": "solid",
      "east": "solid",
      "south": "solid",
      "west": "bombable"
     }
    }
   ]
  },
  {
   "number": 2,
   "shownNumber": 3,
   "color": "#545A00",
   "rooms": [
    {
     "number": 21,
     "column": 7,
     "row": 2,
     "type": "Zigzag Room",
     "enemies": {
      "name": "Gleeok 2"
     },
     "item": {
      "name": "Compass",
      "drop": true,
      "appears": "foes"
     },
     "staircase": null,
     "doors": {
      "north": "solid",
      "east": "solid",
      "south": "locked",
      "west": "solid"
     }
    },
    {
     "number": 32,
     "column": 2,
     "row": 3,
     "type": "Black Room",
     "enemies": {
      "name": "Hungry Goriya"
     },
     "item": null,
     "staircase": null,
     "doors": {
      "north": "solid",
      "east": "solid",
      "south": "open",
      "west": "solid"
     }
    },
    {
     "number": 37,
     "column": 7,
     "row": 3,
     "type": "Horizontal Moat Room",
     "enemies": null,
     "item": null,
     "staircase": null,
     "doors": {
      "north": "locked",
      "east": "solid",
      "south": "open",
      "west": "solid"
     }
    },
    {
     "number": 48,
     "column": 2,
     "row": 4,
     "type": "Reverse C",
     "enemies": {
      "name": "Red Darknut",
      "count": 5
     },
     "item": {
      "name": "5 Rupees",
      "drop": false,
      "appears": "floor"
     },
     "staircase": {
      "kind": "transport",
      "number": 1,
      "to": 69
     },
     "doors": {
      "north": "open",
      "east": "solid",
      "south": "solid",
      "west": "solid"
     }
    },
    {
     "number": 53,
     "column": 7,
     "row": 4,
     "type": "Single Six Block Room",
     "enemies": {
      "name": "Red Bubble",
      "count": 8
     },
     "item": {
      "name": "Triforce",
      "drop": true,
      "appears": "foes"
     },
     "staircase": null,
     "doors": {
      "north": "shutter",
      "east": "solid",
      "south": "open",
      "west": "solid"
     }
    },
    {
     "number": 69,
     "column": 7,
     "row": 5,
     "type": "Narrow Stair Room",
     "enemies": {
      "name": "Zol",
      "count": 5
     },
     "item": null,
     "staircase": {
      "kind": "transport",
      "number": 1,
      "to": 48
     },
     "doors": {
      "north": "open",
      "east": "solid",
      "south": "open",
      "west": "solid"
     }
    },
    {
     "number": 85,
     "column": 7,
     "row": 6,
     "type": "Desert Room",
     "enemies": {
      "name": "Blue Bubble",
      "count": 8
     },
     "item": {
      "name": "Power Bracelet",
      "drop": true,
      "appears": "foes"
     },
     "staircase": null,
     "doors": {
      "north": "open",
      "east": "solid",
      "south": "open",
      "west": "solid"
     }
    },
    {
     "number": 101,
     "column": 7,
     "row": 7,
     "type": "Four Tall Room",
     "enemies": {
      "name": "Mixed Enemy Group 18",
      "count": 6
     },
     "item": {
      "name": "Map",
      "drop": true,
      "appears": "foes"
     },
     "staircase": null,
     "doors": {
      "north": "shutter",
      "east": "solid",
      "south": "locked",
      "west": "solid"
     }
    },
    {
     "number": 102,
     "column": 8,
     "row": 7,
     "type": "Four Fireball Room",
     "enemies": {
      "name": "Red Bubble",
      "count": 8
     },
     "item": {
      "name": "Boomerang",
      "drop": false,
      "appears": "floor"
     },
     "staircase": null,
     "doors": {
      "north": "solid",
      "east": "solid",
      "south": "open",
      "west": "solid"
     }
    },
    {
     "number": 117,
     "column": 7,
     "row": 8,
     "type": "Entrance Room",
     "enemies": null,
     "item": null,
     "staircase": null,
     "doors": {
      "north": "locked",
      "east": "locked",
      "south": "open",
      "west": "solid"
     }
    },
    {
     "number": 118,
     "column": 8,
     "row": 8,
     "type": "Spike Trap Room",
     "enemies": {
      "name": "Mixed Enemy Group 12",
      "count": 6
     },
     "item": null,
     "staircase": null,
     "doors": {
      "north": "open",
      "east": "solid",
      "south": "solid",
      "west": "locked"
     }
    }
   ]